{
  "manifest_version": 1,
  "run_id": "amelie-lab-mark-mark-20260930T160255-20da1f-fe3a4547cf9f4e57",
  "plan_id": "lab-2026-10-10-amelie-lab-mark-mark-20260930T160255-20da1f-fe3a4547cf9f4e57",
  "engine": "review",
  "model": "gemini-2.5-flash",
  "existence_check": false,
  "survivors": {
    "count": 2,
    "status": "ungeprueft"
  },
  "files": [
    "06-suche/proposals/lab-2026-10-10-amelie-lab-mark-mark-20260930T160255-20da1f-fe3a4547cf9f4e57.md",
    "06-suche/proposals/lab-2026-10-10-amelie-lab-mark-mark-20260930T160255-20da1f-fe3a4547cf9f4e57.inbox.json",
    "06-suche/proposals/lab-2026-10-10-amelie-lab-mark-mark-20260930T160255-20da1f-fe3a4547cf9f4e57.manifest.json"
  ],
  "source_ops": [],
  "grave_proposals": 0,
  "touches_memory": false,
  "contracts": {
    "mark-record": "1.5.0"
  },
  "contract_version": "1.0.0"
}
