{
  "manifest_version": 1,
  "run_id": "amelie-lab-lacunar-lacunar-20261001T122442-6750db-d2b538919c7e46fa",
  "plan_id": "lab-2026-10-10-amelie-lab-lacunar-lacunar-20261001T122442-6750db-d2b538919c7e46fa",
  "engine": "review",
  "model": "gemini-2.5-flash",
  "existence_check": false,
  "survivors": {
    "count": 3,
    "status": "ungeprueft"
  },
  "files": [
    "06-suche/proposals/lab-2026-10-10-amelie-lab-lacunar-lacunar-20261001T122442-6750db-d2b538919c7e46fa.md",
    "06-suche/proposals/lab-2026-10-10-amelie-lab-lacunar-lacunar-20261001T122442-6750db-d2b538919c7e46fa.inbox.json",
    "06-suche/proposals/lab-2026-10-10-amelie-lab-lacunar-lacunar-20261001T122442-6750db-d2b538919c7e46fa.manifest.json"
  ],
  "source_ops": [],
  "grave_proposals": 2,
  "touches_memory": false,
  "contracts": {
    "lacunar-record": "1.2.0"
  },
  "contract_version": "1.0.0"
}
