{
  "manifest_version": 1,
  "run_id": "lacunar-20260929T210403-8dcdf7",
  "plan_id": "lab-2026-09-30-lacunar-20260929T210403-8dcdf7",
  "engine": "lacunar",
  "model": "gemini-2.5-flash",
  "existence_check": false,
  "survivors": {
    "count": 5,
    "status": "ungeprueft"
  },
  "files": [
    "06-suche/proposals/lab-2026-09-30-lacunar-20260929T210403-8dcdf7.md",
    "06-suche/proposals/lab-2026-09-30-lacunar-20260929T210403-8dcdf7.manifest.json"
  ],
  "source_ops": [],
  "grave_proposals": 1,
  "touches_memory": false,
  "contracts": {
    "write-plan": "see plan",
    "lacunar-run": "1.0.0"
  },
  "contract_version": "1.0.0"
}
