{
  "manifest_version": 1,
  "run_id": "amelie-lab-inversion-inversion-20261014T140238-kids-repair-library-5f33a667ee7c5615",
  "plan_id": "lab-2026-10-14-amelie-lab-inversion-inversion-20261014T140238-kids-repair-library-5f33a667ee7c5615",
  "engine": "review",
  "model": "Codex subagent (stand-in; searches: WebSearch)",
  "existence_check": false,
  "survivors": {
    "count": 0,
    "status": "keine"
  },
  "files": [
    "06-suche/proposals/lab-2026-10-14-amelie-lab-inversion-inversion-20261014T140238-kids-repair-library-5f33a667ee7c5615.md",
    "06-suche/proposals/lab-2026-10-14-amelie-lab-inversion-inversion-20261014T140238-kids-repair-library-5f33a667ee7c5615.inbox.json",
    "06-suche/proposals/lab-2026-10-14-amelie-lab-inversion-inversion-20261014T140238-kids-repair-library-5f33a667ee7c5615.manifest.json"
  ],
  "source_ops": [],
  "grave_proposals": 3,
  "touches_memory": false,
  "contracts": {
    "inversion-record": "1.1.0"
  },
  "contract_version": "1.0.0"
}
