{
  "manifest_version": 1,
  "run_id": "lacunar-20261001T175927-61a1a9",
  "plan_id": "lab-2026-10-01-lacunar-20261001T175927-61a1a9",
  "engine": "lacunar",
  "model": "gemini-2.5-flash",
  "existence_check": false,
  "survivors": {
    "count": 5,
    "status": "ungeprueft"
  },
  "files": [
    "06-suche/proposals/lab-2026-10-01-lacunar-20261001T175927-61a1a9.md",
    "06-suche/proposals/lab-2026-10-01-lacunar-20261001T175927-61a1a9-source.json",
    "06-suche/proposals/lab-2026-10-01-lacunar-20261001T175927-61a1a9.manifest.json"
  ],
  "source_ops": [
    {
      "op": "source.add",
      "id": "dlg-dlg-pruefschema-sensorische-qualitaetspruefung",
      "human_accepted": false,
      "urls": [
        "https://www.dlg.org/fileadmin/downloads/Expertenwissen/lebensmittelsensorik/2009_2_Expertenwissen_Sensorik_Methoden_Ueberblick.pdf"
      ]
    }
  ],
  "grave_proposals": 1,
  "touches_memory": false,
  "contracts": {
    "write-plan": "see plan",
    "lacunar-run": "1.2.0"
  },
  "contract_version": "1.0.0"
}
