{
  "manifest_version": 1,
  "run_id": "lacunar-20261001T122442-6750db",
  "plan_id": "lab-2026-10-01-lacunar-20261001T122442-6750db",
  "engine": "lacunar",
  "model": "gemini-2.5-flash",
  "existence_check": false,
  "survivors": {
    "count": 3,
    "status": "ungeprueft"
  },
  "files": [
    "06-suche/proposals/lab-2026-10-01-lacunar-20261001T122442-6750db.md",
    "06-suche/proposals/lab-2026-10-01-lacunar-20261001T122442-6750db.manifest.json"
  ],
  "source_ops": [],
  "grave_proposals": 2,
  "touches_memory": false,
  "contracts": {
    "write-plan": "see plan",
    "lacunar-run": "1.2.0"
  },
  "contract_version": "1.0.0"
}
