{
  "manifest_version": 1,
  "run_id": "amelie-lab-lacunar-lacunar-20260929T203438-f693a3-31d72a38da35a809",
  "plan_id": "lab-2026-10-10-amelie-lab-lacunar-lacunar-20260929T203438-f693a3-31d72a38da35a809",
  "engine": "review",
  "model": "gemini-2.5-pro",
  "existence_check": false,
  "survivors": {
    "count": 2,
    "status": "ungeprueft"
  },
  "files": [
    "06-suche/proposals/lab-2026-10-10-amelie-lab-lacunar-lacunar-20260929T203438-f693a3-31d72a38da35a809.md",
    "06-suche/proposals/lab-2026-10-10-amelie-lab-lacunar-lacunar-20260929T203438-f693a3-31d72a38da35a809.inbox.json",
    "06-suche/proposals/lab-2026-10-10-amelie-lab-lacunar-lacunar-20260929T203438-f693a3-31d72a38da35a809.manifest.json"
  ],
  "source_ops": [],
  "grave_proposals": 2,
  "touches_memory": false,
  "contracts": {
    "lacunar-record": "1.0.0"
  },
  "contract_version": "1.0.0"
}
