{
  "manifest_version": 1,
  "run_id": "amelie-lab-lacunar-lacunar-20260930T210642-66f73d-b4454272a612cb2b",
  "plan_id": "lab-2026-10-10-amelie-lab-lacunar-lacunar-20260930T210642-66f73d-b4454272a612cb2b",
  "engine": "review",
  "model": "gemini-2.5-flash",
  "existence_check": false,
  "survivors": {
    "count": 5,
    "status": "ungeprueft"
  },
  "files": [
    "06-suche/proposals/lab-2026-10-10-amelie-lab-lacunar-lacunar-20260930T210642-66f73d-b4454272a612cb2b.md",
    "06-suche/proposals/lab-2026-10-10-amelie-lab-lacunar-lacunar-20260930T210642-66f73d-b4454272a612cb2b.inbox.json",
    "06-suche/proposals/lab-2026-10-10-amelie-lab-lacunar-lacunar-20260930T210642-66f73d-b4454272a612cb2b.manifest.json"
  ],
  "source_ops": [],
  "grave_proposals": 1,
  "touches_memory": false,
  "contracts": {
    "lacunar-record": "1.2.0"
  },
  "contract_version": "1.0.0"
}
