{
  "manifest_version": 1,
  "run_id": "lacunar-20261001T163628-ee76cb",
  "plan_id": "lab-2026-10-01-lacunar-20261001T163628-ee76cb",
  "engine": "lacunar",
  "model": "gemini-2.5-flash",
  "existence_check": false,
  "survivors": {
    "count": 3,
    "status": "ungeprueft"
  },
  "files": [
    "06-suche/proposals/lab-2026-10-01-lacunar-20261001T163628-ee76cb.md",
    "06-suche/proposals/lab-2026-10-01-lacunar-20261001T163628-ee76cb-source.json",
    "06-suche/proposals/lab-2026-10-01-lacunar-20261001T163628-ee76cb.manifest.json"
  ],
  "source_ops": [
    {
      "op": "source.add",
      "id": "ichthyologie-graphical-key-for-the",
      "human_accepted": false,
      "urls": [
        "https://www.ichthyologie.de/wp-content/uploads/2025/03/Stahl_etal_2025_Graphical_key_German_freshwater_fishes-Bull_Fish_Biol-20_87-122.pdf"
      ]
    }
  ],
  "grave_proposals": 3,
  "touches_memory": false,
  "contracts": {
    "write-plan": "see plan",
    "lacunar-run": "1.2.0"
  },
  "contract_version": "1.0.0"
}
