{
  "manifest_version": 1,
  "run_id": "amelie-lab-inversion-inversion-20260930T181151-f9650e-d36303df10a75bb4",
  "plan_id": "lab-2026-10-10-amelie-lab-inversion-inversion-20260930T181151-f9650e-d36303df10a75bb4",
  "engine": "review",
  "model": "gemini-2.5-flash",
  "existence_check": false,
  "survivors": {
    "count": 2,
    "status": "ungeprueft"
  },
  "files": [
    "06-suche/proposals/lab-2026-10-10-amelie-lab-inversion-inversion-20260930T181151-f9650e-d36303df10a75bb4.md",
    "06-suche/proposals/lab-2026-10-10-amelie-lab-inversion-inversion-20260930T181151-f9650e-d36303df10a75bb4.inbox.json",
    "06-suche/proposals/lab-2026-10-10-amelie-lab-inversion-inversion-20260930T181151-f9650e-d36303df10a75bb4.manifest.json"
  ],
  "source_ops": [],
  "grave_proposals": 2,
  "touches_memory": false,
  "contracts": {
    "inversion-record": "1.0.0"
  },
  "contract_version": "1.0.0"
}
