{
  "manifest_version": 1,
  "run_id": "lacunar-20261001T153054-cca9b8",
  "plan_id": "lab-2026-10-01-lacunar-20261001T153054-cca9b8",
  "engine": "lacunar",
  "model": "gemini-2.5-flash",
  "existence_check": false,
  "survivors": {
    "count": 3,
    "status": "ungeprueft"
  },
  "files": [
    "06-suche/proposals/lab-2026-10-01-lacunar-20261001T153054-cca9b8.md",
    "06-suche/proposals/lab-2026-10-01-lacunar-20261001T153054-cca9b8-source.json",
    "06-suche/proposals/lab-2026-10-01-lacunar-20261001T153054-cca9b8.manifest.json"
  ],
  "source_ops": [
    {
      "op": "source.add",
      "id": "trademate-manuelle-bestandsverwaltung-in-hoflaeden",
      "human_accepted": false,
      "urls": [
        "https://trademate.de/warenwirtschaft-hofladen.html"
      ]
    }
  ],
  "grave_proposals": 2,
  "touches_memory": false,
  "contracts": {
    "write-plan": "see plan",
    "lacunar-run": "1.2.0"
  },
  "contract_version": "1.0.0"
}
