{
  "manifest_version": 1,
  "run_id": "amelie-lab-inversion-inversion-20261001T153054-8519a7-14a3fc2144744a9f",
  "plan_id": "lab-2026-10-10-amelie-lab-inversion-inversion-20261001T153054-8519a7-14a3fc2144744a9f",
  "engine": "review",
  "model": "deepseek/deepseek-chat",
  "existence_check": false,
  "survivors": {
    "count": 3,
    "status": "ungeprueft"
  },
  "files": [
    "06-suche/proposals/lab-2026-10-10-amelie-lab-inversion-inversion-20261001T153054-8519a7-14a3fc2144744a9f.md",
    "06-suche/proposals/lab-2026-10-10-amelie-lab-inversion-inversion-20261001T153054-8519a7-14a3fc2144744a9f.inbox.json",
    "06-suche/proposals/lab-2026-10-10-amelie-lab-inversion-inversion-20261001T153054-8519a7-14a3fc2144744a9f.manifest.json"
  ],
  "source_ops": [],
  "grave_proposals": 1,
  "touches_memory": false,
  "contracts": {
    "inversion-record": "1.0.0"
  },
  "contract_version": "1.0.0"
}
